{
  "$schema": "./schemas/graphics-evidence.schema.json",
  "schemaVersion": 1,
  "generatedAtUtc": "2026-07-14T22:36:59Z",
  "acceptancePolicy": {
    "requiredPassGates": [
      "provenance",
      "rightsAndDistribution",
      "staticConfiguration",
      "runtimeModuleAllowlist",
      "liveWindow",
      "backbufferCapture",
      "screenshotCorpus",
      "aspectAndHud",
      "casHaloAndClipping",
      "framePacing",
      "stabilitySoak",
      "rollback",
      "manualVisualSelection"
    ],
    "artifactRequiredGates": [
      "backbufferCapture",
      "screenshotCorpus",
      "framePacing",
      "stabilitySoak",
      "rollback",
      "manualVisualSelection"
    ],
    "allowNotApplicableForAcceptance": [
      "casHaloAndClipping"
    ],
    "maximumP95RegressionPercent": 10,
    "minimumGameplayMinutes": 10,
    "minimumSoakMinutes": 30,
    "casMaximumHaloOvershootPercent": 3,
    "aspectErrorMaximumPercent": 0.1
  },
  "candidates": [
    {
      "profileId": "safe-native-4x3",
      "stage": "configuration-verified",
      "disposition": "pending",
      "blockers": [],
      "rejectionReason": null,
      "gates": {
        "provenance": {
          "state": "pass",
          "note": "Exact 59NL base executable is locked and the profile adds no proxy.",
          "artifactRefs": [
            "repo:config/sources.lock.json"
          ]
        },
        "rightsAndDistribution": {
          "state": "pass",
          "note": "Local-import-only SEGA client boundary remains enforced.",
          "artifactRefs": [
            "repo:config/sources.lock.json"
          ]
        },
        "staticConfiguration": {
          "state": "pass",
          "note": "Native fallback declares the application as its sole D3D8 owner.",
          "artifactRefs": [
            "repo:config/graphics-profiles.json"
          ]
        },
        "runtimeModuleAllowlist": {
          "state": "pending",
          "note": "Repeat after the unified lifecycle work is complete.",
          "artifactRefs": []
        },
        "liveWindow": {
          "state": "pending",
          "note": "Safe-mode window capture is not yet indexed.",
          "artifactRefs": []
        },
        "backbufferCapture": {
          "state": "pending",
          "note": "No RenderDoc capture is indexed.",
          "artifactRefs": []
        },
        "screenshotCorpus": {
          "state": "pending",
          "note": "Required lossless scene corpus is not complete.",
          "artifactRefs": []
        },
        "aspectAndHud": {
          "state": "pending",
          "note": "Fallback pillar and HUD measurements are not complete.",
          "artifactRefs": []
        },
        "casHaloAndClipping": {
          "state": "not-applicable",
          "note": "This profile has no post-processing.",
          "artifactRefs": []
        },
        "framePacing": {
          "state": "pending",
          "note": "PresentMon baseline is not indexed.",
          "artifactRefs": []
        },
        "stabilitySoak": {
          "state": "pending",
          "note": "Thirty-minute soak is not indexed.",
          "artifactRefs": []
        },
        "rollback": {
          "state": "pending",
          "note": "Unified-launcher rollback evidence is not complete.",
          "artifactRefs": []
        },
        "manualVisualSelection": {
          "state": "pending",
          "note": "Native remains a safety baseline rather than the visual winner.",
          "artifactRefs": []
        }
      }
    },
    {
      "profileId": "clarity-dgvoodoo-4x3",
      "stage": "runtime-verified",
      "disposition": "pending",
      "blockers": [],
      "rejectionReason": null,
      "gates": {
        "provenance": {
          "state": "pass",
          "note": "Exact dgVoodoo 2.87.3 archive, x86 D3D8 member, and configuration are locked.",
          "artifactRefs": [
            "repo:config/sources.lock.json"
          ]
        },
        "rightsAndDistribution": {
          "state": "pass",
          "note": "Local evaluation is permitted; public wrapper bundling remains separately gated.",
          "artifactRefs": [
            "repo:config/sources.lock.json"
          ]
        },
        "staticConfiguration": {
          "state": "pass",
          "note": "D3D11 FL11, 3840x2880, Lanczos-3, watermark-off, and single-owner checks pass.",
          "artifactRefs": [
            "repo:config/graphics-profiles.json"
          ]
        },
        "runtimeModuleAllowlist": {
          "state": "pass",
          "note": "The live client loaded the approved local x86 d3d8.dll, D3D11, and DXGI without a competing proxy.",
          "artifactRefs": [
            "runtime:canary/runtime/client/client-profile.json#sha256=416da9c6ece726f74bd052e2637f23dfa0dfc95b4e22eddff0c7d84e3c4fbc33",
            "runtime:canary/runtime/client/d3d8.dll#sha256=2fe0314195d0caf2c72c5496352c4235858b0f104a3a2b0d88832f15f76faf57"
          ]
        },
        "liveWindow": {
          "state": "pass",
          "note": "A responsive exact 2560x1600 borderless window was observed with the watermark disabled.",
          "artifactRefs": [
            "runtime:canary/runtime/client/client-profile.json#sha256=416da9c6ece726f74bd052e2637f23dfa0dfc95b4e22eddff0c7d84e3c4fbc33"
          ]
        },
        "backbufferCapture": {
          "state": "pending",
          "note": "The settings contract does not prove the actual render target; a RenderDoc capture is required.",
          "artifactRefs": []
        },
        "screenshotCorpus": {
          "state": "pending",
          "note": "Required lossless scene corpus is not complete.",
          "artifactRefs": []
        },
        "aspectAndHud": {
          "state": "pending",
          "note": "Expected 4:3 pillars and HUD geometry still require indexed pixel measurements.",
          "artifactRefs": []
        },
        "casHaloAndClipping": {
          "state": "not-applicable",
          "note": "This baseline has no post-processing.",
          "artifactRefs": []
        },
        "framePacing": {
          "state": "pending",
          "note": "PresentMon trace is not indexed.",
          "artifactRefs": []
        },
        "stabilitySoak": {
          "state": "pending",
          "note": "Thirty-minute soak is not indexed.",
          "artifactRefs": []
        },
        "rollback": {
          "state": "pending",
          "note": "One-click launcher rollback evidence is not complete.",
          "artifactRefs": []
        },
        "manualVisualSelection": {
          "state": "pending",
          "note": "Same-scene blind A/B selection is not complete.",
          "artifactRefs": []
        }
      }
    },
    {
      "profileId": "lab-widescreen-16x10",
      "stage": "runtime-verified",
      "disposition": "pending",
      "blockers": [
        "The widescreen reference remains an immutable local-only black-box dependency and cannot enter a public release.",
        "RenderDoc backbuffer proof, the complete scene and HUD corpus, representative gameplay pacing, the thirty-minute soak, rollback, and blind A/B remain incomplete."
      ],
      "rejectionReason": null,
      "gates": {
        "provenance": {
          "state": "pass",
          "note": "The annotated tag object, peeled commit, ASI-only release digest, and loader digest are pinned.",
          "artifactRefs": [
            "repo:config/sources.lock.json"
          ]
        },
        "rightsAndDistribution": {
          "state": "pass",
          "note": "The reference is confined to an immutable local-only black-box profile and cannot enter public releases.",
          "artifactRefs": [
            "repo:config/graphics-profiles.json"
          ]
        },
        "staticConfiguration": {
          "state": "pass",
          "note": "dgVoodoo remains the sole D3D8 owner; dinput8 and the ASI are explicit non-D3D8 layers.",
          "artifactRefs": [
            "repo:config/graphics-profiles.json"
          ]
        },
        "runtimeModuleAllowlist": {
          "state": "pass",
          "note": "The exact local-lab profile loaded dgVoodoo as the sole D3D8 owner plus the pinned dinput8 loader and widescreen ASI; the widescreen log records successful 2560x1600 initialization.",
          "artifactRefs": [
            "runtime:last-known-good/clients/client-20260714T165753511Z-local-lab-lab-widescreen-16x10/client-profile.json#sha256=1e1c8def613f4abeb0f7910962c6d4d5f4f87d13ad936a4114ad68c15384c19b",
            "runtime:last-known-good/clients/client-20260714T165753511Z-local-lab-lab-widescreen-16x10/pso_widescreen.log#sha256=05a1f96164bc1182f6c5d94f2133f2a7ae7d0426327bd68ec2ed42d9fe07fd7d"
          ]
        },
        "liveWindow": {
          "state": "pass",
          "note": "A responsive, watermark-free, exact 2560x1600 borderless true-widescreen window was observed on the physical panel.",
          "artifactRefs": [
            "runtime:graphics-evidence/lab-widescreen-16x10/20260714T165245895Z/screenshots/lobby-2560x1600-native-lanczos3.png#sha256=664be0792cc951843488169ec6761c74d0108237e442d18b5530a141827ad0a5"
          ]
        },
        "backbufferCapture": {
          "state": "pending",
          "note": "No RenderDoc capture is indexed.",
          "artifactRefs": []
        },
        "screenshotCorpus": {
          "state": "pending",
          "note": "An exploratory lossless 2560x1600 lobby capture exists, but the required episode, menu, HUD, effects, fog, and boss corpus is incomplete.",
          "artifactRefs": [
            "runtime:graphics-evidence/lab-widescreen-16x10/20260714T165245895Z/screenshots/lobby-2560x1600-native-lanczos3.png#sha256=664be0792cc951843488169ec6761c74d0108237e442d18b5530a141827ad0a5"
          ]
        },
        "aspectAndHud": {
          "state": "pending",